Author,Source,Review
Alka Hingorani,Amazon,"I wanted to like this product. I ended up disliking it immensely.1. It is inaccurate. My piece showed 20 points lower than what an Accucheck blood sugar monitor does. It asks you to calibrate the levels against an external reference. What's the point of spending so much if every sensor needs to be calibrated. (btw, the Accucheck showed the same reading as a reputed diagnostic lab)2. It is wildly misleading. It says that the normal range is 70-110 at *all times*, which is WRONG. It is well known that this range is considered normal when one has been fasting (12 or more hours since the last meal). Once you have eaten something, the sugar will go up, which is absolutely ok, as long as it settles down to 140 or below two hours later. To simplify, a normal person would have less than 110 on waking up, and less than 140 two hours after a big meal. The M1 starts screaming anytime the level is more than 110, which makes NO sense at all. I pointed this out to their support and to the CEO/Founder, who sent me a bunch of research papers, none of which had anything to do with this basic error.3. The app allows you to annotate the graph with events such as meals, exercise, sleep etc. But it still has no clue about post-prandial sugar, which defeats a big reason for entering these details.4. It is expensive. The sensor costs Rs. 6000 for 14 days (1 day is taken in auto-calibration), after which you have to throw it. And each replacement will have to be newly calibrated (see point 1)5. The app interface looks slick at first sight, but is AWFUL; it is basically a clutter of advertisements. The opening screen shows the Ring; I was most confused until I learnt that they are hawking another product. You are constantly urged to subscribe for something or the other. One can enter food details, but it is very limited (compare to HealthifyMe). The list goes on.6. The packaging is gorgeous, but once unpacked, there are no directions about how to install it. The app, as I said, is useless. I finally had to rely on someone's youtube video.7. Having to change it every 15 days contributes a whole chunk of plastic to the landfill.The only good thing about this product is its slick marketing."
"	Consumer",Amazon,"So I got the Ultrahuman M1 to track my glucose readings (I am not Diabetic but its genetic so precautionary tracking).First of all you get a package with Freestyle Libre Pro (launched in 2016), alcohol wipes and some patches to protect the sensor. If you are for some reason not able to install it properly, they provide a mail letter to send for free replacement. This is a nice touch and removes the hesitation of first time installation.Installing was a bit weird cause when I was trying to push the applicator it was not working. Saw the video and read instructions and it said it should be easy push Eventually it did work after 10 mins of fiddling. Libre's competitor is Dexcom which has a button press apply which is much better.Now coming to how these things work, they work with interstitial fluid (which is fluid that surrounds the cells of the tissues below your skin). Now Glucose enters bloodstream first and then diffuses to interstitial glucose. This causes a lag between the actual glucose and what this reads. This can vary from 10 mins to an hour depending on individual to individual.Since Libre Pro was released in 2016, it is now ancient technology which has quite some lag. Imaging using a 2016 phone now. Abbott has released Libre 3 quite some back which has much better readings. The MRP mentioned on the sensor was Rs 2661.I was surprised by this since in Europe they give Libre 2 in Jan 2022. You can google Techcruch review to see this. Libre 3 was approved in May 2022 and they might be giving that sensor to Americans/Europeans now.Now it takes 8-24 hours to initialize, where it might give false reading. For me even after 24 hours the reading were too high and I compared it with Blood monitor and there was a significant difference of 20-30 mg/dL. It also thought the same and asked me to calibrate it. So you would need a blood glucometer to calibrate it otherwise readings will be way off.Reading wise it is not reliable and you need to check with glucometer regularly.Their app is a bit confusing and filled with their own advertisement so much that it can be difficult to find stuff that you want to see (in my case food review, glucose readings, etc.). Most other apps will show you the product you have at the home page and all data their. But not Ultrahuman. You will just see big bold adds of their products all over.Finally when you get to the page you need, you can enter food details, sleep details, activity details and be able to correlate to spike or crashes. This can help you identify foods that makes your glucose level rise significantly. There is also a ChatGPT integration (their words) that suggests you what you can do with the means.Overall I would suggest don't go with the product. It is overpriced for an inferior product. Instead go with Abbott Freestyle Libre 3 or Dexcom G7 directly and couple that with food logging in Healthifyme. You can get the job done at 50% of the cost. Slightly more effort but paying double for it is not worth it esp for outdated tech.There are also Healthifyme and one more company that offers this. I haven't checked them in detail out but the rates are same. Not sure which sensor they send.TLDR: Indians are given inferior 2016 tech against Europeans/Americans who get the latest. Overpriced with a cluttered ad full app. Not at all for diabetics as readings are not accurate and you need to calibrate."
Vikram Vaidya,Amazon,Tchnically very high quality
silvia m.,Amazon,"In the package there are 2 sensors but one of the two expired on February 10, 2024, the second expires in June 2025, I did not open it and I returned it"
Klaus,Amazon,The sensor or the product might be good. I can’t say - I am only using it for a day. But what everyone needs to know is: what you buy here is a sensor that will only work for 2 weeks. After that you need to buy a subscription that effectively coasts more than 2000€ per year. If you are prepared to do that I guess it’s fine to buy - otherwise don’t.
Hari Hemachandran,Amazon,I have type 2 diabetes and I always struggled to get my sugar low. Probably my best investment to buy these cgms.Now I know what I have been doing wrong and the app alerts at the right time to move or walk to get my sugar low.This is just my 1st week so far I can say it does what it states
Christian,Amazon,"Based on the title of the article, the buyer comments and the unboxing videos that can be found online, I assumed that there were two sensors. One was delivered. Generation 2. The FreeStyle Libre 3 can be purchased directly from the manufacturer, for significantly less money.In short: I felt like I was pulled over the counter and immediately returned the product. 105 euros for a 14-day sensor is simply too expensive.Otherwise: Everything is very nicely presented and certainly a cool device and an interesting app. So a second point."
